{
  "format": "analysis-graph/0.1",
  "generator": "whatran.py/0.4.0",
  "generated_at": "2026-10-30T20:13:30Z",
  "project": {
    "name": "Synthetic LC-MS pilot",
    "description": "Which features differ between group A and group B in a simulated 12-sample experiment?"
  },
  "nodes": [
    {
      "id": "art-raw-signal-csv-1",
      "type": "artifact",
      "label": "Raw signal (synthetic)",
      "path": "data/raw_signal.csv",
      "sha256": "55419a23f262f5ac57c1e524913525ce0a7e68f08a8cffb4980a715a71a09bbf",
      "size": 56728,
      "exists": true,
      "recorded_at": "2026-10-30T20:13:28Z",
      "recorded_by": "make_demo.sh",
      "note": "Stand-in for an mzML export. Three planted features at m/z 151.1 (A high), 301.1 (B high), 330.1 (equal).",
      "role": "intermediate",
      "generated_by": "run-simulate-raw-signal-1",
      "used_by": [
        "run-detect-peaks-loose-1",
        "run-detect-peaks-1"
      ],
      "integrity": "intact",
      "on_main_path": true
    },
    {
      "id": "run-simulate-raw-signal-1",
      "type": "run",
      "label": "Simulate raw signal",
      "command": "python3 scripts/simulate.py --seed 7 --n 12 data/raw_signal.csv",
      "code": [
        {
          "path": "scripts/simulate.py",
          "sha256": "f275ce105a4742d6a7476e599754c0f949acb5c45ebbc75a80c87ade8824e602"
        }
      ],
      "params": {
        "seed": 7,
        "n": 12
      },
      "inputs": [],
      "outputs": [
        "art-raw-signal-csv-1"
      ],
      "status": "completed",
      "evidence": {
        "level": "observed",
        "exec_ids": [
          "x-0001"
        ],
        "source": "ag-run",
        "exit_code": 0,
        "started": "2026-10-30T20:13:28Z",
        "ended": "2026-10-30T20:13:28Z",
        "duration_ms": 125,
        "cwd": ".",
        "stdout_head": "wrote data/raw_signal.csv: 12 samples x 250 bins\n",
        "stderr_head": "",
        "outputs_observed": [
          "data/raw_signal.csv"
        ]
      },
      "environment": {
        "python": "3.14.8",
        "platform": "macOS-15.8.1-arm64-arm-64bit-Mach-O"
      },
      "git": {
        "commit": "001c3814ef6277be3fd6506e35a1d0adda005106",
        "dirty": true
      },
      "verified_by_replay": true,
      "recorded_at": "2026-10-30T20:13:29Z",
      "recorded_by": "make_demo.sh",
      "on_main_path": true,
      "replay": {
        "ts": "2026-10-30T20:13:30Z",
        "source": "local-check",
        "manifest": "whatran.json"
      }
    },
    {
      "id": "art-peaks-loose-csv-1",
      "type": "artifact",
      "label": "peaks_loose.csv",
      "path": "results/peaks_loose.csv",
      "sha256": "33187036a1c8af18da14d070fea64e464200beacb04dc8086991ae49909179b0",
      "size": 7799,
      "exists": true,
      "recorded_at": "2026-10-30T20:13:29Z",
      "recorded_by": "make_demo.sh",
      "role": "result",
      "generated_by": "run-detect-peaks-loose-1",
      "used_by": [],
      "integrity": "intact",
      "on_main_path": false
    },
    {
      "id": "run-detect-peaks-loose-1",
      "type": "run",
      "label": "Detect peaks (loose)",
      "command": "python3 scripts/detect_peaks.py --threshold 1.1 data/raw_signal.csv results/peaks_loose.csv",
      "code": [
        {
          "path": "scripts/detect_peaks.py",
          "sha256": "3a1dff3d35de75bd05933c36495bb1849cbe0dbcee874a7c5461050aeaab33fa"
        }
      ],
      "params": {
        "threshold": 1.1
      },
      "inputs": [
        "art-raw-signal-csv-1"
      ],
      "outputs": [
        "art-peaks-loose-csv-1"
      ],
      "status": "rejected",
      "evidence": {
        "level": "observed",
        "exec_ids": [
          "x-0002"
        ],
        "source": "ag-run",
        "exit_code": 0,
        "started": "2026-10-30T20:13:29Z",
        "ended": "2026-10-30T20:13:29Z",
        "duration_ms": 40,
        "cwd": ".",
        "stdout_head": "27 peaks above 1.1 x median (1.11) -> results/peaks_loose.csv\n",
        "stderr_head": "",
        "outputs_observed": [
          "results/peaks_loose.csv"
        ]
      },
      "environment": {
        "python": "3.14.8",
        "platform": "macOS-15.8.1-arm64-arm-64bit-Mach-O"
      },
      "git": {
        "commit": "001c3814ef6277be3fd6506e35a1d0adda005106",
        "dirty": true
      },
      "verified_by_replay": false,
      "recorded_at": "2026-10-30T20:13:29Z",
      "recorded_by": "make_demo.sh",
      "status_reason": "Threshold 1.1 calls 27 bins as peaks, most of them noise at the floor of the mean spectrum",
      "status_changed_at": "2026-10-30T20:13:29Z",
      "on_main_path": false
    },
    {
      "id": "art-peaks-csv-1",
      "type": "artifact",
      "label": "peaks.csv",
      "path": "results/peaks.csv",
      "sha256": "f7b703b52efb4ebbe6dd945525429f7e3de2a95b37a14936ffd8877ca0714a52",
      "size": 920,
      "exists": true,
      "recorded_at": "2026-10-30T20:13:29Z",
      "recorded_by": "make_demo.sh",
      "role": "intermediate",
      "generated_by": "run-detect-peaks-1",
      "used_by": [
        "run-compare-groups-with-welch-t-test-1"
      ],
      "integrity": "intact",
      "on_main_path": true
    },
    {
      "id": "run-detect-peaks-1",
      "type": "run",
      "label": "Detect peaks",
      "command": "python3 scripts/detect_peaks.py --threshold 5 data/raw_signal.csv results/peaks.csv",
      "code": [
        {
          "path": "scripts/detect_peaks.py",
          "sha256": "3a1dff3d35de75bd05933c36495bb1849cbe0dbcee874a7c5461050aeaab33fa"
        }
      ],
      "params": {
        "threshold": 5
      },
      "inputs": [
        "art-raw-signal-csv-1"
      ],
      "outputs": [
        "art-peaks-csv-1"
      ],
      "status": "completed",
      "evidence": {
        "level": "observed",
        "exec_ids": [
          "x-0003"
        ],
        "source": "ag-run",
        "exit_code": 0,
        "started": "2026-10-30T20:13:29Z",
        "ended": "2026-10-30T20:13:29Z",
        "duration_ms": 40,
        "cwd": ".",
        "stdout_head": "3 peaks above 5.0 x median (5.04) -> results/peaks.csv\n",
        "stderr_head": "",
        "outputs_observed": [
          "results/peaks.csv"
        ]
      },
      "environment": {
        "python": "3.14.8",
        "platform": "macOS-15.8.1-arm64-arm-64bit-Mach-O"
      },
      "git": {
        "commit": "001c3814ef6277be3fd6506e35a1d0adda005106",
        "dirty": true
      },
      "verified_by_replay": true,
      "recorded_at": "2026-10-30T20:13:29Z",
      "recorded_by": "make_demo.sh",
      "on_main_path": true,
      "replay": {
        "ts": "2026-10-30T20:13:30Z",
        "source": "local-check",
        "manifest": "whatran.json"
      }
    },
    {
      "id": "art-stats-json-1",
      "type": "artifact",
      "label": "stats.json",
      "path": "results/stats.json",
      "sha256": "a211f6692e98ba69d7df173ba7221bdd6dad3368af40c18228e5137fdb757608",
      "size": 766,
      "exists": true,
      "recorded_at": "2026-10-30T20:13:29Z",
      "recorded_by": "make_demo.sh",
      "role": "result",
      "generated_by": "run-compare-groups-with-welch-t-test-1",
      "used_by": [],
      "integrity": "intact",
      "on_main_path": true
    },
    {
      "id": "art-volcano-svg-1",
      "type": "artifact",
      "label": "volcano.svg",
      "path": "results/volcano.svg",
      "sha256": "90a3202e4194cb83ab66f09f8904bcae74f6631ef8bf189c5305d17a385e938c",
      "size": 1182,
      "exists": true,
      "recorded_at": "2026-10-30T20:13:29Z",
      "recorded_by": "make_demo.sh",
      "role": "result",
      "generated_by": "run-compare-groups-with-welch-t-test-1",
      "used_by": [],
      "integrity": "intact",
      "on_main_path": true
    },
    {
      "id": "run-compare-groups-with-welch-t-test-1",
      "type": "run",
      "label": "Compare groups with Welch t-test",
      "command": "python3 scripts/stats.py results/peaks.csv results/stats.json results/volcano.svg",
      "code": [
        {
          "path": "scripts/stats.py",
          "sha256": "4bee8a2bca9ea93fcc32fe1773f2b8f60619fb9e5b88aeb463f191828e8b4939"
        }
      ],
      "params": {
        "test": "welch",
        "alpha": 0.05
      },
      "inputs": [
        "art-peaks-csv-1"
      ],
      "outputs": [
        "art-stats-json-1",
        "art-volcano-svg-1"
      ],
      "status": "completed",
      "evidence": {
        "level": "observed",
        "exec_ids": [
          "x-0004"
        ],
        "source": "ag-run",
        "exit_code": 0,
        "started": "2026-10-30T20:13:29Z",
        "ended": "2026-10-30T20:13:29Z",
        "duration_ms": 27,
        "cwd": ".",
        "stdout_head": "3 peaks tested, 2 significant at alpha=0.05: m/z 151.1 (log2fc -0.70, p=2.1e-05), m/z 301.1 (log2fc +0.73, p=3.6e-05)\n",
        "stderr_head": "",
        "outputs_observed": [
          "results/stats.json",
          "results/volcano.svg"
        ]
      },
      "environment": {
        "python": "3.14.8",
        "platform": "macOS-15.8.1-arm64-arm-64bit-Mach-O"
      },
      "git": {
        "commit": "001c3814ef6277be3fd6506e35a1d0adda005106",
        "dirty": true
      },
      "verified_by_replay": true,
      "recorded_at": "2026-10-30T20:13:29Z",
      "recorded_by": "make_demo.sh",
      "on_main_path": true,
      "replay": {
        "ts": "2026-10-30T20:13:30Z",
        "source": "local-check",
        "manifest": "whatran.json"
      }
    },
    {
      "id": "claim-feature-at-m-z-301-1-is-higher-in-group-1",
      "type": "claim",
      "label": "Feature at m/z 301.1 is higher in group B (Welch p < 0.05)",
      "supported_by": [
        "art-volcano-svg-1"
      ],
      "status": "tentative",
      "recorded_at": "2026-10-30T20:13:29Z",
      "recorded_by": "make_demo.sh",
      "on_main_path": true
    },
    {
      "id": "claim-feature-at-m-z-151-1-is-higher-in-group-1",
      "type": "claim",